_id,url,title,price
23cfebb15bb74c669786be1cfb3a2d0e47cb033a7d4f2cee6527b0c3d0f08c45,the-midnight-assassin-panic-scandal-and-the-hunt-for-americas-first-serial-killer_549/index.html,"The Midnight Assassin: Panic, Scandal, and the Hunt for America's First Serial Killer",£28.45
cdbad1f5eb6b0c4aa4d481719a1abe57d671e2de65fa28930caa917f1578c62c,the-martian-the-martian-1_548/index.html,The Martian (The Martian #1),£41.39
96ce994476e420a1df782f946bb25575b2e7d1913cf29e534dc0f24bd39ac506,the-high-mountains-of-portugal_547/index.html,The High Mountains of Portugal,£51.15
8179b30b663c8c57f82b421c7979020de32d242a1b1703f897a2884202f3df90,the-grownup_546/index.html,The Grownup,£35.88
aad91d9540d15bf1ca89b0de83add471174adef4d7018f5253dc13467ea12758,the-e-myth-revisited-why-most-small-businesses-dont-work-and-what-to-do-about-it_545/index.html,The E-Myth Revisited: Why Most Small Businesses Don't Work and What to Do About It,£36.91
b2393262854a27a59c4b509aab3d1f8755f7fa64cce70633f9a1a55afcbe3a82,south-of-sunshine_544/index.html,South of Sunshine,£28.93
ec06617589467bb29d23cc1755c20aea3a3906bd32afecc47da0a040719186d5,smarter-faster-better-the-secrets-of-being-productive-in-life-and-business_543/index.html,Smarter Faster Better: The Secrets of Being Productive in Life and Business,£38.89
b43af9c7cc8e1f23924dea4af33c3a58243dc79fb973829705f6e2ca38331322,silence-in-the-dark-logan-point-4_542/index.html,Silence in the Dark (Logan Point #4),£58.33
5b80eefe62bfc6718f86a79f5be25b93cc6dbcc1387120a98bd3db9ec0bef77e,shadows-of-the-past-logan-point-1_541/index.html,Shadows of the Past (Logan Point #1),£39.67
67672f4ebab479c4b187b87846e6e74c9d97ae31af158e1273726be44906d674,roller-girl_540/index.html,Roller Girl,£14.10
b6f248b36495f8fd9b79f9fa3d5cefe3c80b5e8ede014b2dd49d4b05cf30b29d,rising-strong_539/index.html,Rising Strong,£21.82
2c244ba9f42facec0a2c97f74eac4082057ddab0e184462427d70c7f00d5b0a6,proofs-of-god-classical-arguments-from-tertullian-to-barth_538/index.html,Proofs of God: Classical Arguments from Tertullian to Barth,£54.21
410a00eb2d48ce022c0d833ceff4790daf9d7f057d47a97f0c1a6a6afe73082b,please-kill-me-the-uncensored-oral-history-of-punk_537/index.html,Please Kill Me: The Uncensored Oral History of Punk,£31.19
c9255be38071c0bd46fc62c7076554ccf619dcebe3b3ca4f26477d2d5fd3bef6,out-of-print-city-lights-spotlight-no-14_536/index.html,Out of Print: City Lights Spotlight No. 14,£53.64
0aa46dbece7ac7d3c8bfa13b236425735f7dcea9592045f29961fc0c621809d1,my-life-next-door-my-life-next-door_535/index.html,My Life Next Door (My Life Next Door ),£36.39
eba8b91376b5475442161d4e5cdc4d0fdec88eb4133fd8caa3c254a2d6081ceb,millers-valley_534/index.html,Miller's Valley,£58.54
2296c7acf4f58a8c6be7f617b787afe19b66119542822b5d0fda01062d27ad00,mans-search-for-meaning_533/index.html,Man's Search for Meaning,£29.48
358852045e2cfd8a9ecaa4975766233dd77ef67d22859e7818044795fef7e89b,love-that-boy-what-two-presidents-eight-road-trips-and-my-son-taught-me-about-a-parents-expectations_532/index.html,"Love That Boy: What Two Presidents, Eight Road Trips, and My Son Taught Me About a Parent's Expectations",£25.06
0bb670cd2ec3b441ee1a780c6ab38408ddd782a6562d122514f80a83cb28b6d7,living-forward-a-proven-plan-to-stop-drifting-and-get-the-life-you-want_531/index.html,Living Forward: A Proven Plan to Stop Drifting and Get the Life You Want,£12.55
e4f3170d597d09cd2c4c53f11b44b5206f1c90178d1fcb4d7a3465fa3d57bfa9,les-fleurs-du-mal_530/index.html,Les Fleurs du Mal,£29.04
c5ad859068eb0a85d75a3428d5f36218504edf13a6e8d22285186626196419cc,left-behind-left-behind-1_529/index.html,Left Behind (Left Behind #1),£40.72
6ca2e45f1207ab6e5729088e0e0518c7602a15aed35ed78dd2bce0a78c32e193,kill-em-and-leave-searching-for-james-brown-and-the-american-soul_528/index.html,Kill 'Em and Leave: Searching for James Brown and the American Soul,£45.05
0e4eb6b0a59ea2eeacce1e297c5519a31bf04565dce5394de500f2e4be742854,kierkegaard-a-christian-missionary-to-christians_527/index.html,Kierkegaard: A Christian Missionary to Christians,£47.13
d9ac34ef26683af79fccadb6436c1110082de7950ba68a09b23cbece28f2366e,john-vassos-industrial-design-for-modern-life_526/index.html,John Vassos: Industrial Design for Modern Life,£20.22
b36f1b4b62c3a3473c59a0cf4da8926beece174ca3d29a1e2781d63bfd470be4,ill-give-you-the-sun_525/index.html,I'll Give You the Sun,£56.48
e54a36677637d7d013aa408b2ae93019e92d7f272c9ed8a641bb4898eb5fd50d,i-will-find-you_524/index.html,I Will Find You,£44.21
6b42ab432db616954cb94ac3f5677038a50c8db844f7f12ecf5814b5eb152732,hystopia-a-novel_523/index.html,Hystopia: A Novel,£21.96
01bc2892bb3d5b384aff7465c2afb433f4384ed597ccbc044e320e6b37e4b186,howl-and-other-poems_522/index.html,Howl and Other Poems,£40.45
b7fcf4852585d3ea5c9d0062f529f8168f8c620b09abf745f77688ffeedd668a,history-of-beauty_521/index.html,History of Beauty,£10.29
9af5cda94f48ea0a780bcba1c550ad3d8707381f5f82e791dcf59d5b1069cf25,heaven-is-for-real-a-little-boys-astounding-story-of-his-trip-to-heaven-and-back_520/index.html,Heaven is for Real: A Little Boy's Astounding Story of His Trip to Heaven and Back,£52.86
d162cb45f811f17a41285a7ea7016852579d916d6dd1121ed083ca0f41f26d05,future-shock-future-shock-1_519/index.html,Future Shock (Future Shock #1),£55.65
b1dd17818a08fddc16a9fbb5e7e23606d9865c612033e6e3a2091f4db59ac5a7,enders-game-the-ender-quintet-1_518/index.html,Ender's Game (The Ender Quintet #1),£43.64
ab182b3d5b3cde4f167f1c6769645e6d7eb2aa8af9d7f88ac6d709c0057eaf22,diary-of-a-citizen-scientist-chasing-tiger-beetles-and-other-new-ways-of-engaging-the-world_517/index.html,Diary of a Citizen Scientist: Chasing Tiger Beetles and Other New Ways of Engaging the World,£28.41
355bf1209a8d2ff7ae247ee80fcc351cd34435eca04362b5212367a04f79f022,death-by-leisure-a-cautionary-tale_516/index.html,Death by Leisure: A Cautionary Tale,£37.51
f50aa0db7f305909e90f77fdc4da4a707005e662f0a80e6b2ae9ba87eaa0b60d,brilliant-beacons-a-history-of-the-american-lighthouse_515/index.html,Brilliant Beacons: A History of the American Lighthouse,£11.45
78b9782eb726da6fd259dc2ae84a50251a77a419d1459b2dea1c983ac9b9a441,brazen-the-courage-to-find-the-you-thats-been-hiding_514/index.html,Brazen: The Courage to Find the You That's Been Hiding,£19.22
95980e628813660401ba3c0c03ad11c1b5dc5dbbd634e7d295e85bed17b187e7,between-the-world-and-me_513/index.html,Between the World and Me,£56.91
625efd14c9cc3ad772ff4ae4effd723e52cc4b94644ce9501bed3293f438b575,being-mortal-medicine-and-what-matters-in-the-end_512/index.html,Being Mortal: Medicine and What Matters in the End,£55.06
118456a3e56fd50fa47bbd0e03b361a3956f915841067c7be88a57fa6eaaef0a,a-murder-over-a-girl-justice-gender-junior-high_511/index.html,"A Murder Over a Girl: Justice, Gender, Junior High",£13.20
c35a7032680555477ecdbcb70116defd38bf0f596606e17c507eb7f1a1201d83,32-yolks_510/index.html,32 Yolks,£53.63
94a9e23ac8b2859c16a22eba89ec0bb2047400b2eafc40843878992f3164fd4d,most-blessed-of-the-patriarchs-thomas-jefferson-and-the-empire-of-the-imagination_509/index.html,"""Most Blessed of the Patriarchs"": Thomas Jefferson and the Empire of the Imagination",£44.48
4b97d0afb42f0a01cba61633d0306cfab19b41f9638258c280a0b1a5673f5485,you-are-a-badass-how-to-stop-doubting-your-greatness-and-start-living-an-awesome-life_508/index.html,You Are a Badass: How to Stop Doubting Your Greatness and Start Living an Awesome Life,£12.08
0a37d569a03156f53fb25f70345bcd537c0d503718b0849e6e33a8edf88fe4c4,wildlife-of-new-york-a-five-borough-coloring-book_507/index.html,Wildlife of New York: A Five-Borough Coloring Book,£22.14
7afc0dbeabb3debebd1477a4004a3f252ab962a2e1c94a49b64a86ed7c7ede65,what-happened-on-beale-street-secrets-of-the-south-mysteries-2_506/index.html,What Happened on Beale Street (Secrets of the South Mysteries #2),£25.37
770842672ebc653256a470364405e47e16e1da0c20aea275f0153b3dea70abe6,unreasonable-hope-finding-faith-in-the-god-who-brings-purpose-to-your-pain_505/index.html,Unreasonable Hope: Finding Faith in the God Who Brings Purpose to Your Pain,£46.33
78aeb2033132bdde61e7b6a0ae587e487e363fdb665b60cf435f8caa1e0bfa60,under-the-tuscan-sun_504/index.html,Under the Tuscan Sun,£37.33
308ae45fd483efee83259e67dda1cb7856633ce77ec732522dad4fc557896547,toddlers-are-aholes-its-not-your-fault_503/index.html,Toddlers Are A**holes: It's Not Your Fault,£25.55
4f60c92021ac28b2d30fb9552bf38224820302739b3fc66fa08be2177189dd7a,the-year-of-living-biblically-one-mans-humble-quest-to-follow-the-bible-as-literally-as-possible_502/index.html,The Year of Living Biblically: One Man's Humble Quest to Follow the Bible as Literally as Possible,£34.72
3c684cc4b508725cc4da9751b3ee75c34d1c9c5d29289e424b29b5794c910e25,the-whale_501/index.html,The Whale,£35.96
3d5ff76d08a488e3abae1c6e958ee1c7f4384d7b667765a2627b8d926792c698,the-story-of-art_500/index.html,The Story of Art,£41.14
6658611d7adab2821b49d7c79916eb2ce160d7779cd553b531c2b48f1c97938a,the-origin-of-species_499/index.html,The Origin of Species,£10.01
014e8188353347387cc045d36c5fcdcdad4b2fe0d29fbe7a4485f58095bd6480,the-great-gatsby_498/index.html,The Great Gatsby,£36.05
4fa2f6941c7f86f0675a2a2b778fb48348358283bb2f167191b134afe31c4398,the-good-girl_497/index.html,The Good Girl,£49.03
49dac41bd00ce0c47c2f8f8b01192dda43d3fd178e23724ac0197681b2e69471,the-glass-castle_496/index.html,The Glass Castle,£16.24
3552e33331a4f08808113705654b1360b00afeecc131055b52d78c1797cf1a03,the-faith-of-christopher-hitchens-the-restless-soul-of-the-worlds-most-notorious-atheist_495/index.html,The Faith of Christopher Hitchens: The Restless Soul of the World's Most Notorious Atheist,£39.55
18540de4cf83efc1623c049387a3cf38536aea8e53736b1023988494a7ab022c,the-drowning-girls_494/index.html,The Drowning Girls,£35.67
4f67a34cbf074f6ddab1bd805ac2a2c401052afde079473710717914a6d03e48,the-constant-princess-the-tudor-court-1_493/index.html,The Constant Princess (The Tudor Court #1),£16.62
95a4f6c051b8c30a91ea09963f06332b5e28c7669dce410f5a115c332619fa6a,the-bourne-identity-jason-bourne-1_492/index.html,The Bourne Identity (Jason Bourne #1),£42.78
7967167956643523ba4cd65e393f4a46664fecbdfacc8e6cbd743226b8bb213f,the-bachelor-girls-guide-to-murder-herringford-and-watts-mysteries-1_491/index.html,The Bachelor Girl's Guide to Murder (Herringford and Watts Mysteries #1),£52.30
d1c598af1e304af0db767d7500652e8816e966da8e46be43f29b2033cdae8e80,the-art-book_490/index.html,The Art Book,£32.34
52349a38926377b61f03204d048dd3dcae7ab6e1f153f479766775f5c0be4506,the-7-habits-of-highly-effective-people-powerful-lessons-in-personal-change_489/index.html,The 7 Habits of Highly Effective People: Powerful Lessons in Personal Change,£33.17
bc6b0fdf717d007c0456618a8ceb9585b8fd620f9395447390fe7f4b5dc1246f,team-of-rivals-the-political-genius-of-abraham-lincoln_488/index.html,Team of Rivals: The Political Genius of Abraham Lincoln,£20.12
5151424f5394f1d7039c84e48253c5db1cdaf1fac1ce1fae83259d7e5e0f4916,steal-like-an-artist-10-things-nobody-told-you-about-being-creative_487/index.html,Steal Like an Artist: 10 Things Nobody Told You About Being Creative,£20.90
2bd93a2816ab22701a5e5e1830edb5ee26cd0286489520292d4e5580a4eeb9a7,sit-stay-love_486/index.html,"Sit, Stay, Love",£20.90
c2e0836a1b602d7106d508bcb314e269684015068278d08b749c34ece880b62b,sister-dear_485/index.html,Sister Dear,£40.20
029362f21d10b0e1b1032ade0633813189f124e655212c294c9ae7fc2532e6e5,shrunken-treasures-literary-classics-short-sweet-and-silly_484/index.html,"Shrunken Treasures: Literary Classics, Short, Sweet, and Silly",£52.87
efbe80597eb977a1b0f6cd6248c862dd1219488782f948f467c258cb6597b8fe,rich-dad-poor-dad_483/index.html,"Rich Dad, Poor Dad",£51.74
6a3fe5b96615b9097e387d943e00b294bd0197f081236ee717315b8a8b974956,raymie-nightingale_482/index.html,Raymie Nightingale,£34.41
ee657c374fbeed12b7ae1b6a71dc75812cbdae30a2aec54a7705de24da7c8686,playing-from-the-heart_481/index.html,Playing from the Heart,£32.38
e6fab716f3b6b34b447eb698f6fbaa6b8ee2666bb1801adafe9e5c975388d42c,nightstruck-a-novel_480/index.html,Nightstruck: A Novel,£50.35
673172036c27f94f4d7a0cca93406d3d047bde396ec28aa235587de4d0156bb7,naturally-lean-125-nourishing-gluten-free-plant-based-recipes-all-under-300-calories_479/index.html,"Naturally Lean: 125 Nourishing Gluten-Free, Plant-Based Recipes--All Under 300 Calories",£11.38
6ab1e6f8bf440f5b659ec936098ff9107b87e588d218fdf6c0c5af760e9191d3,meternity_478/index.html,Meternity,£43.58
9c1fbc363e47385fc6d4438c5772acafe8592d32df6372c64f244407ae6325a6,memoirs-of-a-geisha_477/index.html,Memoirs of a Geisha,£49.67
e6da9a15db916bb7cb9efe5a65e355d309dd8aa86d9274791b4a7aa0d02b9f6e,like-never-before-walker-family-2_476/index.html,Like Never Before (Walker Family #2),£28.77
75ae45846d197ad31e862b2c91505699e59c60e02d60d613fb742f3db1459019,life-of-pi_475/index.html,Life of Pi,£13.22
52d6a79dc8deb581766283ab84aa1f86113ef7daaa8358f6b9854c45d63d3ea4,leave-this-song-behind-teen-poetry-at-its-best_474/index.html,Leave This Song Behind: Teen Poetry at Its Best,£51.17
4b12287fedab187e8355162ad90d862145a76d16c838091899ee935e5f03adb6,kings-folly-the-kinsman-chronicles-1_473/index.html,King's Folly (The Kinsman Chronicles #1),£39.61
b28e19a910a3bb7aad601435c5074303a79db2ae2757ba27db998c0b3b349e29,john-adams_472/index.html,John Adams,£57.43
291a19305db74c208e986f57e05d4a115ff7be57e5dcc8e0907312ecc03f2872,how-to-cook-everything-vegetarian-simple-meatless-recipes-for-great-food-how-to-cook-everything_471/index.html,How to Cook Everything Vegetarian: Simple Meatless Recipes for Great Food (How to Cook Everything),£46.01
e73466a67d4697cc33a3f7c11a88bc0d7949cff23e1278d6dda85782c682196b,how-to-be-a-domestic-goddess-baking-and-the-art-of-comfort-cooking_470/index.html,How to Be a Domestic Goddess: Baking and the Art of Comfort Cooking,£28.25
f1f10f065b6511a9d7c3aa38504fcfc911a227750b6e4a45d91d2355e501cf3b,good-in-bed-cannie-shapiro-1_469/index.html,Good in Bed (Cannie Shapiro #1),£37.05
14076d2dafaba9c891b458513d037cae203efa864e271e84909948e94b0377af,fruits-basket-vol-7-fruits-basket-7_468/index.html,"Fruits Basket, Vol. 7 (Fruits Basket #7)",£19.57
8625cda0fb18c3f1578a5aa55ea48148a4c5f3185aacf619fa950afd172b9655,for-the-love-fighting-for-grace-in-a-world-of-impossible-standards_467/index.html,For the Love: Fighting for Grace in a World of Impossible Standards,£45.13
f4a5ff4dfb03ce7d7f72ca6fc74bc71790b1ffbe8ad5ace730967f0a8ae0f16a,finding-god-in-the-ruins-how-god-redeems-pain_466/index.html,Finding God in the Ruins: How God Redeems Pain,£46.64
651d5fbcb6cfe867b7bdf0d2e2cfbd301a73b57a6727400abca836f865dcd3b0,every-heart-a-doorway-every-heart-a-doorway-1_465/index.html,Every Heart a Doorway (Every Heart A Doorway #1),£12.16
e047ce05cf20f5c7b3ecf79b4aa7431b385e90d2b7015f2fb256075c5db1f081,delivering-the-truth-quaker-midwife-mystery-1_464/index.html,Delivering the Truth (Quaker Midwife Mystery #1),£20.89
de2af1b6bbbc496e2539da3fd0f3d0349816004ca984880cca3d56f5a7523579,counted-with-the-stars-out-from-egypt-1_463/index.html,Counted With the Stars (Out from Egypt #1),£17.97
ac00351777c93147788b02933351ea4fd0a7801301f72435a9263e416dcfb5b5,chronicles-vol-1_462/index.html,"Chronicles, Vol. 1",£52.60
aea484c3d6acc25313851d2e0ca1c059c2252dd3e8e26314ba4c6fca807aee4d,blue-like-jazz-nonreligious-thoughts-on-christian-spirituality_461/index.html,Blue Like Jazz: Nonreligious Thoughts on Christian Spirituality,£25.77
aa11e4ede7296e324645ba8246076c2b4cab54c0e5592f303431115ef4faa0c7,benjamin-franklin-an-american-life_460/index.html,Benjamin Franklin: An American Life,£48.19
aa0149f477da8bbbae84116f662edbebb8e51d8fbd293e6ba98dab58a35a1201,at-the-existentialist-cafe-freedom-being-and-apricot-cocktails-with-jean-paul-sartre-simone-de-beauvoir-albert-camus-martin-heidegger-edmund-husserl-karl-jaspers-maurice-merleau-ponty-and-others_459/index.html,"At The Existentialist Café: Freedom, Being, and apricot cocktails with: Jean-Paul Sartre, Simone de Beauvoir, Albert Camus, Martin Heidegger, Edmund Husserl, Karl Jaspers, Maurice Merleau-Ponty and others",£29.93
97d467b65fdcbc065a3ad7c5f31e05af84c0589ed5e20962037d80beb2b3cfbc,a-summer-in-europe_458/index.html,A Summer In Europe,£44.34
c656dbd15df7367f108d59ed1f261a08616fec59dccada4a473a602fcf780c76,a-short-history-of-nearly-everything_457/index.html,A Short History of Nearly Everything,£52.40
7c335d2ae08dcde49c416a6e779c7b9f173801d87c7b14e2a812a80b7294bbef,a-gathering-of-shadows-shades-of-magic-2_456/index.html,A Gathering of Shadows (Shades of Magic #2),£44.81
69b87a1415720b5207d20b908adbfc2d1219aaed00104cf25b6a7fa3c4eda9df,the-sound-of-love_455/index.html,The Sound Of Love,£57.84
7deb2aa8cfa4ee488fc527bce7eb127486685d2c4a590742a3f601ef6f8fcda2,the-rise-and-fall-of-the-third-reich-a-history-of-nazi-germany_454/index.html,The Rise and Fall of the Third Reich: A History of Nazi Germany,£39.67
5b8d106a85c9511ecfdcbb62a432e3d39a5026e375d88a6a2066b618c977080e,the-perks-of-being-a-wallflower_453/index.html,The Perks of Being a Wallflower,£55.02
0f02045a07a979b0e7183db37eb2561b2b4b9a184195c2371fae5770ddec6837,the-mysterious-affair-at-styles-hercule-poirot-1_452/index.html,The Mysterious Affair at Styles (Hercule Poirot #1),£24.80
a45161def6a63e482a99bfaaa35b19da75f9b5cfb42fa4f6b0d067a031e86488,the-man-who-mistook-his-wife-for-a-hat-and-other-clinical-tales_451/index.html,The Man Who Mistook His Wife for a Hat and Other Clinical Tales,£59.45
d074b714f77080bbc858bffb3830bca28105f41e5b17fe6d1608f895d2acfdf4,the-makings-of-a-fatherless-child_450/index.html,The Makings of a Fatherless Child,£31.58
cd5026dd566a6f372f583f7595a298ac5215dbc2655623f690c30d332cfae7bb,the-joy-of-cooking_449/index.html,The Joy of Cooking,£43.27
986adc1e06550f0ad44c5733b651be3773d239fee11358aa475f4b33fa10fbea,the-invention-of-wings_448/index.html,The Invention of Wings,£37.34
1c1353630c2aa3ae086e5df3a5308c102e585f9db3c500a5619460e60db42646,the-hobbit-middle-earth-universe_447/index.html,The Hobbit (Middle-Earth Universe),£17.80
3677962641508f7c8c2338b4f84d366319d9d5051315322815babcf4bb3509e2,the-great-railway-bazaar_446/index.html,The Great Railway Bazaar,£30.54
b083143b8b21fbaa55070e4fc87c2eafc695341cb222b989ad98098611499614,the-golden-compass-his-dark-materials-1_445/index.html,The Golden Compass (His Dark Materials #1),£18.77
c5f97d06209823e534bf26e610e5ce697efce35d94c0738e478cbd006f156f3e,the-god-delusion_444/index.html,The God Delusion,£46.85
86ead5f8a63abb3b02db698dddda1e6771116fde9de889691eadc3995b33bd81,the-girl-you-left-behind-the-girl-you-left-behind-1_443/index.html,The Girl You Left Behind (The Girl You Left Behind #1),£15.79
c35a3da473b595e1bcc3122510b23ade1aab2bbb386571089ef2c81adb6e5916,the-fellowship-of-the-ring-the-lord-of-the-rings-1_442/index.html,The Fellowship of the Ring (The Lord of the Rings #1),£10.27
0d0244ae819326a418bb9c06db1183afb43d94210fdd1ce4636a66759c9e5435,the-collected-poems-of-wb-yeats-the-collected-works-of-wb-yeats-1_441/index.html,The Collected Poems of W.B. Yeats (The Collected Works of W.B. Yeats #1),£15.42
0f59b379e36343f5438d7bc0f80f1199e981bd65de7d4bd0d60e7a2717938266,the-barefoot-contessa-cookbook_440/index.html,The Barefoot Contessa Cookbook,£59.92
c1172f55aa09b4d6dfe36903a60b7083913d7ce2fd4c2d52f3570705b8189773,tell-the-wolves-im-home_439/index.html,Tell the Wolves I'm Home,£50.96
7834cc88b56094b8e5a46b719554af5da5d04a2e73af3f73f0e38188a02ad5bc,ship-leaves-harbor-essays-on-travel-by-a-recovering-journeyman_438/index.html,Ship Leaves Harbor: Essays on Travel by a Recovering Journeyman,£30.60
def22f61ffdcc0f539c9608dc00bb0b100ef991c9d40277262ba83b4a6067136,pride-and-prejudice_437/index.html,Pride and Prejudice,£19.27
c9a790e99c3f538cde6ee33447df504226ec755902fc6f03268755437a06a211,musicophilia-tales-of-music-and-the-brain_436/index.html,Musicophilia: Tales of Music and the Brain,£46.58
2ae979040f2e8ad489c0f33ebef059a93e9cc70911a32bce03c5a547bf54e4f2,mere-christianity_435/index.html,Mere Christianity,£48.51
fbdc8167b006dc1ffb7343dc24245f63ebe7beb7bdee6e07cd80da388de902a8,me-before-you-me-before-you-1_434/index.html,Me Before You (Me Before You #1),£19.02
5fd11f6fae98d5fa7405fa76c744876a619ce31216414a0fb9ec27d8a426d5a9,in-the-woods-dublin-murder-squad-1_433/index.html,In the Woods (Dublin Murder Squad #1),£38.38
640197ea044e2b66f1c22ebe4ac8bd737a810ae30f3cbccab8c46f7a2de2f314,in-cold-blood_432/index.html,In Cold Blood,£49.98
27a350e8611b9a8c7115f01f7354dda3886288e966260afd5c88d6da30b1d2fa,how-to-stop-worrying-and-start-living_431/index.html,How to Stop Worrying and Start Living,£46.49
47bc229460b066722dd130decd51ccf7ee57aac8381ff535955c77fbaf26d125,give-it-back_430/index.html,Give It Back,£18.32
45babfcfd7ec5734cde74a0790adb900d49cdaabb7ee4c449911efc5a2e1b52c,girl-interrupted_429/index.html,"Girl, Interrupted",£42.14
bbf5189fc025b6fcae5c6527c902093a9da8d2ebbd660a7410c3844d2697e6c9,fun-home-a-family-tragicomic_428/index.html,Fun Home: A Family Tragicomic,£56.59
457e86b8615ad474e84b7d452b461b3858bbad279a96ed114e620a8ffdb9ce0e,fruits-basket-vol-6-fruits-basket-6_427/index.html,"Fruits Basket, Vol. 6 (Fruits Basket #6)",£20.96
da0f7ddbd8dc7748f5fceecbe0f35b43cda48091b19c3d3b0196fc47490d0e6b,deception-point_426/index.html,Deception Point,£40.32
97681921aab7a2db80f12041eaebd67784ab24f7b76679e308f81ed6449b097c,death-note-vol-6-give-and-take-death-note-6_425/index.html,"Death Note, Vol. 6: Give-and-Take (Death Note #6)",£36.39
0b85188cce9cb41ee3f81cf4933e4907ffd9bf6d65b610cd8c454d387d2e1c89,catherine-the-great-portrait-of-a-woman_424/index.html,Catherine the Great: Portrait of a Woman,£58.55
f793776b346561f758721af6b2d7efd5488c88c6683526cab92592e595286d65,better-homes-and-gardens-new-cook-book_423/index.html,Better Homes and Gardens New Cook Book,£39.61
d5dbcd531372d06e34b96ea6cdf99b0b79d025051fc0d869893935dbc7066f1b,an-unquiet-mind-a-memoir-of-moods-and-madness_422/index.html,An Unquiet Mind: A Memoir of Moods and Madness,£21.30
31cba2056393a2051bd8732ed823c059acae360831b3fc567e771a3b4044a2ee,a-year-in-provence-provence-1_421/index.html,A Year in Provence (Provence #1),£56.88
bf52ab378c5b10a5ecb027aa68e1d5dde1724637659d1c41e9e9843d40133574,world-without-end-the-pillars-of-the-earth-2_420/index.html,World Without End (The Pillars of the Earth #2),£32.97
da4e6b463ebcf1f29eae433b1b1a988222bdbe9b4d8082356a6e71d343c27de8,will-grayson-will-grayson-will-grayson-will-grayson_419/index.html,"Will Grayson, Will Grayson (Will Grayson, Will Grayson)",£47.31
68cf9f55f52817d089045b4231bc2fabed08f2c0607b2d682ff7cbcc2ddaa2c7,why-save-the-bankers-and-other-essays-on-our-economic-and-political-crisis_418/index.html,Why Save the Bankers?: And Other Essays on Our Economic and Political Crisis,£48.67
940120b535d82052b959581bc26c1518463e486a31d5be3e2840d31f73d1b844,where-she-went-if-i-stay-2_417/index.html,Where She Went (If I Stay #2),£41.73
c565ed577c1e3b9b1a079b19d9d9977f500b97b7a79ef519856e6de93122132e,what-if-serious-scientific-answers-to-absurd-hypothetical-questions_416/index.html,What If?: Serious Scientific Answers to Absurd Hypothetical Questions,£53.68
40a40dc2e01d5706bc48912db4c33d5a74915e992687370216339d23b9329197,two-summers_415/index.html,Two Summers,£14.64
9fb5f2a7de83ad5ad4a2c25d1622d8759f69893e7ba1118035b3fd5144c7546a,this-is-your-brain-on-music-the-science-of-a-human-obsession_414/index.html,This Is Your Brain on Music: The Science of a Human Obsession,£38.40
3ec30bab48aaf5e50ef7ac32aa1ec0bb2166b2f17b49876ffbf80eb395d120ea,the-secret-garden_413/index.html,The Secret Garden,£15.08
c069269bed15c5ca80914bfb48dbfd0ee4179f5e77a3e36c63fba8f42e646ded,the-raven-king-the-raven-cycle-4_412/index.html,The Raven King (The Raven Cycle #4),£30.57
2717c456d7d8d09d0ed3b27aa0da665ae95b36a168ca0005add3af93605afa15,the-raven-boys-the-raven-cycle-1_411/index.html,The Raven Boys (The Raven Cycle #1),£57.74
b211fbdcaa003c1cc05e7fda9ed25bcc6d5455c7e5cab2a233619d61d454eefe,the-power-greens-cookbook-140-delicious-superfood-recipes_410/index.html,The Power Greens Cookbook: 140 Delicious Superfood Recipes,£11.05
48eafee5fc89ee4cd3dd79b3d04fcfbd4ca1c638bc100290b94e1bb96116f125,the-metamorphosis_409/index.html,The Metamorphosis,£28.58
3cab9d4c3cf0765ad073924b6a1a9c92cb2d316b2f503e2eef2879d573b3a871,the-mathews-men-seven-brothers-and-the-war-against-hitlers-u-boats_408/index.html,The Mathews Men: Seven Brothers and the War Against Hitler's U-boats,£42.91
a5facd6fc63e58b55ecd27f34550789d143bfef07728d01fe9793e854927ca86,the-little-paris-bookshop_407/index.html,The Little Paris Bookshop,£24.73
20e56133d3d63916d01e19651a3ecadf2736983b828a53be9d6a25717878a535,the-hiding-place_406/index.html,The Hiding Place,£55.91
68401758cac5c23d3a522c4c25cb7076db313f5ee8a2ce6bd827265180c74eee,the-grand-design_405/index.html,The Grand Design,£13.76
2f325f8a6535c472efa58b3820ae94da5b9279534176aa643942a5e4e5aa69a6,the-firm_404/index.html,The Firm,£45.56
bf23de69c5f65b75d4fa356545447f882ae56debce1bb4507efc17d235eb4c5b,the-fault-in-our-stars_403/index.html,The Fault in Our Stars,£47.22
d34361e2ec7702b183895ff99c43d0840ee9b0478ee9d7efd3e328394977fcf0,the-false-prince-the-ascendance-trilogy-1_402/index.html,The False Prince (The Ascendance Trilogy #1),£56.00
24ccddaf5dae61a415b1643d2ee2e03c68d54481744b59d9375c1a0d2e138774,the-expatriates_401/index.html,The Expatriates,£44.58
5f7cc6e7598e43334c209352a3a9a254a8c2dc3e66acc1b9185d30568f87e046,the-dream-thieves-the-raven-cycle-2_400/index.html,The Dream Thieves (The Raven Cycle #2),£34.50
c828e901034881bfe0b44187d5d08a43fe3505210e300533348e57a7e7da2e1a,the-darkest-corners_399/index.html,The Darkest Corners,£11.33
e8f7b6a6f3773203fcc950c7d2cc57cf7fce34e47db1d9128e6dbfae4942a6f7,the-crossover_398/index.html,The Crossover,£38.77
73cf43330ec04c6c7054fc414aa8d212465605eff904265179e37e11bed26177,the-5th-wave-the-5th-wave-1_397/index.html,The 5th Wave (The 5th Wave #1),£11.83
f9ae28f1b1cd25e5346e46fd380010601fcf1788186c35a4b9f067d5319ca891,tell-the-wind-and-fire_396/index.html,Tell the Wind and Fire,£45.51
